,title,permalink,sdg_goal,layout,indicator,indicator_variable,graph,graph_title,graph_type_description,graph_status_notes,variable_description,variable_notes,un_designated_tier,un_custodial_agency,target_id,has_metadata,rationale_interpretation,goal_meta_link,goal_meta_link_page,indicator_name,target,indicator_definition,actual_indicator_available,actual_indicator_available_description,method_of_computation,periodicity,time_period,date_of_national_source_publication,scheduled_update_by_national_source,source_agency_staff_name,source_agency_staff_email,source_agency_survey_dataset,source_title,source_notes,comments_and_limitations,published,source_url,us_method_of_computation,disaggregation_categories,disaggregation_geography,date_metadata_updated,scheduled_update_by_SDG_team,unit_of_measure,international_and_national_references,graoh,variable_unit_label
68,Forest area as a proportion of total land area,/15-1-1/,15,indicator,15.1.1,pct_forest_totland,bar,,Bar graph,Graphed,null,null,1,FAO,15.1,true,,http://unstats.un.org/sdgs/files/metadata-compilation/Metadata-Goal-15.pdf,2,Forest area as a proportion of total land area,"By 2020, ensure the conservation, restoration and sustainable use of terrestrial and inland freshwater ecosystems and their services, in particular forests, wetlands, mountains and drylands, in line with obligations under international agreements.","The indicator is already included among the indicators for the Millennium Development Goals (MDG) (indicator 7.1 \Proportion of land covered by forest\) . In order to provide a precise definition of the indicator, it is crucial to provide a definition of \Forest\ and \Total Land Area\. According to the FAO definitions, Forest is defined as \land spanning more than 0.5 hectares with trees higher than 5 meters and a canopy cover of more than 10 percent, or trees able to reach these thresholds in situ. It does not include land that is predominantly under agricultural or urban land use\. More specifically: \tForest is determined both by the presence of trees and the absence of other predominant land uses. The trees should be able to reach a minimum height of 5 meters. \tIt includes areas with young trees that have not yet reached but which are expected to reach a canopy cover of at least 10 percent and tree height of 5 meters or more. It also includes areas that are temporarily unstocked due to clear-cutting as part of a forest management practice or natural disasters, and which are expected to be regenerated within 5 years. Local conditions may, in exceptional cases, justify that a longer time frame is used. \tIt includes forest roads, firebreaks and other small open areas; forest in national parks, nature reserves and other protected areas such as those of specific environmental, scientific, historical, cultural or spiritual interest. \tIt includes windbreaks, shelterbelts and corridors of trees with an area of more than 0.5 hectares and width of more than 20 meters. \tIt includes abandoned shifting cultivation land with a regeneration of trees that have, or are expected to reach, a canopy cover of at least 10 percent and tree height of at least 5 meters. \tIt includes areas with mangroves in tidal zones, regardless whether this area is classified as land area or not. \tIt includes rubberwood, cork oak and Christmas tree plantations. \tIt includes areas with bamboo and palms provided that land use, height and canopy cover criteria are met. \tIt excludes tree stands in agricultural production systems, such as fruit tree plantations, oil palm plantations, olive orchards and agroforestry systems when crops are grown under tree cover. Note: Some agroforestry systems such as the \Taungya\ system where crops are grown only during the first years of the forest rotation should be classified as forest. Total land area is the total surface area of a country less the area covered by inland waters, like major rivers and lakes.",Forest area as a percentage of total land area,"Forest area, as defined and measured by USDA Forest Service Forest Inventory and Analysis Program, as a proportion of total U.S. land area as measured by U.S. Census. Both measures are used as periodically reported to UN FAO and published in that organization’s Global Forest Resource Assessment (FAO GFRA)",,"Compiled every five years, timed to coincide with submission to FAO GFRA.","Referenced time period represents a snapshot of conditions for the compilation year, which typically lags publication date by 2 years. Data collection is continuous.",October 2014,Next expected agency release: 2019,Guy Robertson,Grobertson02@fs.fed.us,"USDA Forest Service; Research & Development; Inventory, Monitoring and Assessment Research",null,null,"Forest area measures derived from inventory activities involve a complex mix of definitions, sampling protocols and statistical procedures. General information on the USDA Forest Service’s Forest Inventory and Analysis program can be found at: http://www.fia.fs.fed.us/. A summary description of definitions and sampling protocols can be found at: http://www.treesearch.fs.fed.us/pubs/20371. The U.S. forest inventory is conducted on a continuous basis, with results compiled periodically, notably the five year compilations published in the Resource Planning Act Assessment (RPA, see: http://www.srs.fs.usda.gov/pubs/gtr/gtr_wo091.pdf), which are then submitted to UN FAO. The most recent RPA numbers were compiled for 2012 and submitted to UN FAO for their 2015 GFRA report. The next set of RPA numbers will be compiled for 2017 and submitted to FAO for their 2020 GFRA report. Inventory results are sometimes subject to backward revisions, resulting in minor changes to previous period forest area estimates (for this reason, current submissions for SDG 15.1.1 do not exactly match past submissions for Millennium Development Goal 7.1). Total Land Area and Inland Water Bodies are reported by U.S. Census on a ten year basis, the most recent of which was for 2010 and submitted to UN FAO for their 2015 GFRA report. These numbers have not changed considerably over the last two decades (FAO GFRA reports identical total land areas for 1990, 2000, 2005, 2010, and 2015).",true,"Web source: http://www.srs.fs.usda.gov/pubs/gtr/gtr_wo091.pdf. Oswalt, Sonja N.; Smith, W. Brad; Miles, Patrick D.; Pugh, Scott A. 2014. Forest Resources of the United States, 2012: a technical document supporting the Forest Service 2015 update of the RPA Assessment. Gen. Tech. Rep. WO-91. Washington, DC: U.S. Department of Agriculture, Forest Service, Washington Office. 218 p. See: Table 1a. Land area in the United States by major class, region, subregion, and State, 2012.","Total U.S. Forest Area, as defined and measured by USDA Forest Service Forest Inventory and Analysis Program and reported to UN FAO, is divided by Total U.S. Area minus Inland Water Bodies, as defined and measured by U.S. Census and reported to UN FAO: [Total U.S. Forest Area] / [(Total U.S. Area) – (Inland Water Bodies)]. Resulting measures are converted from acres to hectares.",,"Forest inventory data is available at the state and county level, but FAO GFRA reporting is limited to a single national estimate.",,,Percent,"UN FAO Global Forest Resources Assessment 2015: Main Report: Food and Agriculture Organization of the United Nations. 2016. Global Forest Resources Assessment 2015 How are the world’s forests changing? Second edition. UN FAO, Rome. (http://www.fao.org/3/a-i4793e.pdf.). U.S. Country Report: http://www.fao.org/documents/card/en/c/4a446430-0b06-4d1e-b0ae-101d210787c4/. USDA Forest Service, Forest Inventory sampling design and estimations procedures: Bechtold, William A.; Patterson, Paul L.; [Editors]. 2005. The enhanced forest inventory and analysis program - national sampling design and estimation procedures. Gen. Tech. Rep. SRS-80. Asheville, NC: U.S. Department of Agriculture, Forest Service, Southern Research Station. 85 p. (http://www.treesearch.fs.fed.us/pubs/20371).",0,0
69,"Proportion of important sites for terrestrial and freshwater biodiversity that are covered by protected areas, by ecosystem type",/15-1-2/,15,indicator,15.1.2,null,null,null,EPA does not have data,unk,null,null,1,UNEP,15.1,false,,http://unstats.un.org/sdgs/files/metadata-compilation/Metadata-Goal-15.pdf,4,"Proportion of important sites for terrestrial and freshwater biodiversity that are covered by protected areas, by ecosystem type","By 2020, ensure the conservation, restoration and sustainable use of terrestrial and inland freshwater ecosystems and their services, in particular forests, wetlands, mountains and drylands, in line with obligations under international agreements.",,null,null,,null,null,null,null,null,null,null,null,null,null,,null,,null,null,null,null,null,,0,0
70,Progress towards sustainable forest management,/15-2-1/,15,indicator,15.2.1,null,null,null,null,unk,null,null,3,FAO,15.2,true,"The definition of SFM by UN GA contains several key aspects, notably that sustainable forest management is a concept which varies over time and between countries, whose circumstances  ecological, social and economic  vary widely, but that it should always address a wide range of forest values, including economic, social and environmental values, and take intergenerational equity into account. \nClearly a simple measure of change in forest area, while essential, and used for target 15.1, is insufficient to monitor sustainable forest management as a whole. The index proposed combines the two indicators at present under consideration (\forest loss\ and \area certified\) with measures of use/degradation (sub-indicator 2), biodiversity conservation (sub-indicator 3) to give a more rounded picture of sustainable forest management. Further \topical\ sub-indicators will be needed to provide a more comprehensive assessment of SFM aspects. The significance of the four sub-indicators may be briefly explained as follows: \n\t1. Trends in forest area are crucial for monitoring SFM: clearly, if there is significant uncontrolled deforestation, forest management is not sustainable. The indicator focuses on change as there is no ideal share of forest in land cover, as the share is determined by history, ecological circumstances and competing land uses. The indicator covers the net effect of the other parts of Target 15.2: \halt deforestation\ and \substantially increase afforestation and reforestation\. However most countries have reliable data on the components of this overall trend (deforestation, afforestation and reforestation), for which separate targets can be specified, if so desired. This component incorporates the concept of \net permanent forest loss \ at present classified \green\ and is also used for Target 15.1 \n\t2. Changes in the stock of biomass are determined by the balance between increase in volume of wood biomass (annual increment) and decrease (natural losses and damage by fire insects etc., and wood harvest). In a sustainably managed forest, increment is more than losses, so that the biomass stock increases, or does not decrease, and carbon is sequestered from the atmosphere. With very few exceptions, a decline in total biomass stocks, even if the forest area does not decrease, implies unsustainable management (and possible degradation). As the wood/carbon ratio is constant, there will be exactly the same trends for carbon stocks as for wood biomass. Therefore a single indicator addresses carbon stocks and flows and trends in growing stock of wood, and may be expressed in m3 of wood or in tons of carbon. \n\t3. Forest areas managed for the conservation of biodiversity are a proxy for trends in forest biodiversity and a clear indication of political will to incorporate biodiversity into forest management. The CBD Aichi Target 11 calls for each country to conserve at least 17 per cent of terrestrial and inland water areas, so this may be taken as a goal for this element. Work is in hand on developing a number of indicators of forest biodiversity, which may be useful in the future. \n\t4. The fourth parameter looks at the area within a country where a key tool for sustainable forest management is applied. The existence of a \forest management plan\ is a necessary tool for evidence based, long term management. Those areas that are certified by third party schemes as being sustainably managed work on the basis of an independently verified management plan. While the latter fulfils a higher standard, it should be pointed out that there are very significant areas of sustainably managed forest which are not certified, either because their owners have chosen not to seek certification (which is voluntary and market-based) or because no credible (or affordable) certification scheme is in place for that area. The latter is true for most tropical countries. For this reason, using \area of certified forest\ as the sole indicator could give a misleading impression.",http://unstats.un.org/sdgs/files/metadata-compilation/Metadata-Goal-15.pdf,5,Progress towards sustainable forest management,"By 2020, promote the implementation of sustainable management of all types of forests, halt deforestation, restore degraded forests and substantially increase afforestation and reforestation globally.","Sustainable forest management is a central concept for Goal 15 and target 15.1 as well as for target 15.2. It has been formally defined, by the UN General Assembly, as follows: [a] dynamic and evolving concept [that] aims to maintain and enhance the economic, social and environmental values of all types of forests, for the benefit of present and future generations\. (Resolution A/RES/62/98) An \index of sustainable forest management\ with four sub-indicators can be used as a basic indicator of progress towards sustainable forest management by a country. The four sub-indicators are \t1. Annual average percent change in forest area over most recent available 5 year period \t2. Annual average percent change in stock of carbon in above ground biomass over most recent available 5 year period \t3. Share of forest area whose primary designated function is biodiversity conservation, most recent period \t4. Share of forest area under a forest management plan, of which forest area certified under an independent forest management certification scheme, most recent period For each of these components, countries can set national targets, monitor and report on progress. The four sub-indicators will be combined into a single composite index, but targets would be set at the level of sub-indicators. Once targets have been set by national authorities, in terms of the four sub-indicators, and progress measured over an agreed period, countries would assess progress (on track to exceed target, on track to achieve target, progress but at an insufficient rate, no significant overall progress, moving away from target). The final value of the index would be a simple arithmetic average of the values for the four sub-indicators. The use of national targets allows each country to define sustainable forest management for its own specific circumstances, within a coherent international framework. Targets on the sub-indicators can also be set at regional or global levels.",null,null,,null,null,null,null,null,null,null,null,null,null,,null,,null,null,null,null,null,,0,0
71,Proportion of land that is degraded over total land area,/15-3-1/,15,indicator,15.3.1,null,null,null,null,Checking,null,null,3,UNCCD,15.3,false,,http://unstats.un.org/sdgs/files/metadata-compilation/Metadata-Goal-15.pdf,8,Proportion of land that is degraded over total land area,"By 2030, combat desertification, restore degraded land and soil, including land affected by desertification, drought and floods, and strive to achieve a land degradation-neutral world.",,null,null,,null,null,null,null,null,null,null,null,null,null,,null,,null,null,null,null,null,,0,0
72,Coverage by protected areas of important sites for mountain biodiversity,/15-4-1/,15,indicator,15.4.1,null,null,null,Alexa/USGS checking with UN database to assess quality and suitability for reporting Dec 19 3pm e-mails,unk,null,null,2,UNEP-WCMC;\nUNEP,15.4,false,,http://unstats.un.org/sdgs/files/metadata-compilation/Metadata-Goal-15.pdf,9,Coverage by protected areas of important sites for mountain biodiversity,"By 2030, ensure the conservation of mountain ecosystems, including their biodiversity, in order to enhance their capacity to provide benefits that are essential for sustainable development.",,null,null,,null,null,null,null,null,null,null,null,null,null,,null,,null,null,null,null,null,,0,0
73,Mountain Green Cover Index,/15-4-2/,15,indicator,15.4.2,null,null,null,EPA does not have data,unk,null,null,2,FAO,15.4,true,,http://unstats.un.org/sdgs/files/metadata-compilation/Metadata-Goal-15.pdf,9,Mountain Green Cover Index,"By 2030, ensure the conservation of mountain ecosystems, including their biodiversity, in order to enhance their capacity to provide benefits that are essential for sustainable development.","The Green Cover Index is designed to measure the changes of the green vegetation in mountain areas (i.e., forest, shrubs and trees).",null,null,,null,null,null,null,null,null,null,null,null,null,,null,,null,null,null,null,null,,0,0
74,Red List Index,/15-5-1/,15,indicator,15.5.1,null,null,null,FWS (per Rosemaire Gnam) has one component only. Requests clearance at chief leve (Downes) before proceeding.,unk,null,null,2,IUCN; UNEP; CITES,15.5,true,"The worlds species are impacted by a number of threatening processes, including habitat destruction and degradation, overexploitation, invasive alien species, human disturbance, pollution and climate change. This indicator can be used to assess overall changes in the extinction risk of groups of species as a result of these threats and the extent to which threats are being mitigated. \nThe IUCN RLI value ranges from 1 (all species are categorized as Least Concern) to 0 (all species are categorized as Extinct). An intermediate value indicates how far the set of species has moved overall towards extinction. Thus, the IUCN RLI allows comparisons between sets of species in both their overall level of extinction risk (i.e., how threatened they are on average), and in the rate at which this risk changes over time. A downward trend in the IUCN RLI over time means that the expected rate of future species extinctions is worsening (i.e., the rate of biodiversity loss is increasing). An upward trend means that the expected rate of species extinctions is abating (i.e., the rate of biodiversity loss is decreasing), and a horizontal line means that the expected rate of species extinctions is remaining the same, although in each of these cases it does not mean that biodiversity loss has stopped. An upward IUCN RLI trend would indicate that the SDG Target 15.5 of reducing the degradation of natural habitats and protecting threatened species is on track towards halting the loss of biodiversity and thus preventing the extinction of threatened species by 2020. An IUCN RLI value of 1 would indicate that biodiversity loss has been halted. \nThe name \Red List Index\ should not be taken to imply that the indicator is produced as a composite indicator of a number of disparate metrics, in the same way that, e.g., the Multidimensional Poverty Index is compiled. Rather, the RLI is an indicator of trends in species extinction risk, as measured using the IUCN Red List Categories and Criteria, and is compiled from data on changes over time in the Red List Category for each species, excluding any changes driven by improved knowledge or revised taxonomy.",http://unstats.un.org/sdgs/files/metadata-compilation/Metadata-Goal-15.pdf,11,Red List Index,"Take urgent and significant action to reduce the degradation of natural habitats, halt the loss of biodiversity, and, by 2020, protect and prevent the extinction of threatened species.","Definition The Red List Index is a multi-purpose indicator which measures the aggregate change in extinction risk across groups of species. It is based on the number of species in each category of extinction risk on The IUCN Red List of Threatened Species. This indicator is expressed as an index ranging from 0 to 1. Concepts Threatened species are those listed on The IUCN Red List of Threatened Species in the categories Vulnerable, Endangered, or Critically Endangered (i.e., species that are facing a high, very high, or extremely high risk of extinction in the wild in the medium-term future). Changes over time in the proportion of species threatened with extinction are largely driven by improvements in knowledge and changing taxonomy. The IUCN Red List Index (RLI) therefore accounts for such changes to yield a more informative indicator than the simple proportion of threatened species. It measures change in aggregate extinction risk across groups of species over time, resulting from genuine improvements or deteriorations in the status of individual species. It can be calculated for any representative set of species that have been assessed for The IUCN Red List of Threatened Species at least twice.",null,null,"The IUCN RLI is calculated at a point in time by first multiplying the number of species in each Red List Category by a weight (ranging from 1 for Near Threatened to 5 for Extinct and Extinct in the Wild) and summing these values. This is then divided by a maximum threat score which is the total number of species multiplied by the weight assigned to the Extinct category. This final value is subtracted from 1 to give the IUCN RLI value. see report for mathematical calculation expression The formula requires that: \tExactly the same set of species is included in all time periods, and \tThe only Red List Category changes are those resulting from genuine improvement or deterioration in status (i.e., excluding changes resulting from improved knowledge or taxonomic revisions), and \tData Deficient species be excluded. In many cases, species lists will change slightly from one assessment to the next (e.g., owing to taxonomic revisions). The conditions can therefore be met by retrospectively adjusting earlier Red List categorizations using current information and taxonomy. This is achieved by assuming that the current Red List Categories for the taxa have applied since the set of species was first assessed for the Red List, unless there is information to the contrary that genuine status changes have occurred. Such information is often contextual (e.g., relating to the known history of habitat loss within the range of the species). If there is insufficient information available for a newly added species, it is not incorporated into the IUCN RLI until it is assessed for a second time, at which point earlier assessments are retrospectively corrected by extrapolating recent trends in population, range, habitat and threats, supported by additional information. To avoid spurious results from biased selection of species, RLIs are typically calculated only for taxonomic groups in which all species worldwide have been assessed for the Red List, or for samples of species that have been systematically or randomly selected.",null,null,null,null,null,null,null,null,null,null,,null,,null,null,null,null,null,,0,0
