,title,permalink,sdg_goal,layout,indicator,indicator_variable,graph,graph_title,graph_type_description,graph_status_notes,variable_description,variable_notes,un_designated_tier,un_custodial_agency,target_id,has_metadata,rationale_interpretation,goal_meta_link,goal_meta_link_page,indicator_name,target,indicator_definition,actual_indicator_available,actual_indicator_available_description,method_of_computation,periodicity,time_period,date_of_national_source_publication,scheduled_update_by_national_source,source_agency_staff_name,source_agency_staff_email,source_agency_survey_dataset,source_title,source_notes,comments_and_limitations,published,source_url,us_method_of_computation,disaggregation_categories,disaggregation_geography,date_metadata_updated,scheduled_update_by_SDG_team,unit_of_measure,international_and_national_references,graoh,variable_unit_label
126,"Fixed Internet broadband subscriptions per 100 inhabitants, by speed",/17-6-2/,17,indicator,17.6.2,10_mbps_gr_sbscrpts,bar,,Bar graph,Graphed,null,null,1,ITU,17.6,true,"The Internet has become an increasingly important tool to provide access to information, and can help foster and enhance regional and international cooperation on, and access to, science, technology and innovations, and enhance knowledge sharing. High-speed Internet access is important to ensure that Internet users have quality access to the Internet and can take advantage of the growing amount of Internet content  including user-generated content , services and information. While the number of fixed-broadband subscriptions has increased substantially over the last years and while service providers offer increasingly higher speeds, fixed Internet broadband can vary tremendously by speed, thus affecting the quality and functionality of Internet access. Many countries, especially in the developing world, have not only a very limited amount of fixed-broadband subscriptions, but also at very low speeds. This limitation is a barrier to the Target 17.6 and the indicator highlights the potential of the Internet (especially through high-speed access) to enhance cooperation, improve access to science, technology and innovation, and share knowledge. The indicator also highlights the importance of Internet use as a development enabler and helps to measure the digital divide, which, if not properly addressed, will aggravate inequalities in all development domains. Information on fixed broadband subscriptions by speed will contribute to the design of targeted policies to overcome those divides.",http://unstats.un.org/sdgs/files/metadata-compilation/Metadata-Goal-17.pdf,12,"Fixed Internet broadband subscriptions per 100 inhabitants, by speed","Enhance North-South, South-South and triangular regional and international cooperation on and access to science, technology and innovation and enhance knowledge sharing on mutually agreed terms, including through improved coordination among existing mechanisms, in particular at the United Nations level, and through a global technology facilitation mechanism.","The indicator fixed Internet broadband subscriptions, by speed, refers to the number of fixed broadband subscriptions to the public Internet, split by advertised download speed. Fixed Internet broadband subscriptions refer to subscriptions to high-speed access to the public Internet (a TCP/IP connection), at downstream speeds equal to, or greater than, 256 kbit/s. This includes cable modem, DSL, fibre-to-the-home/building, other fixed (wired)- broadband subscriptions, satellite broadband and terrestrial fixed wireless broadband. This total is measured irrespective of the method of payment. It excludes subscriptions that have access to data communications (including the Internet) via mobile-cellular networks. It should include fixed WiMAX and any other fixed wireless technologies. It includes both residential subscriptions and subscriptions for organizations. The Internet is a worldwide public computer network. It provides access to a number of communication services including the World Wide Web and carries e-mail, news, entertainment and data files. The indicator is currently broken down by the following subscription speeds: \t256 kbit/s to less than 2 Mbit/s subscriptions: Refers to all fixed broadband Internet subscriptions with advertised downstream speeds equal to, or greater than, 256 kbit/s and less than 2 Mbit/s. \t2 Mbit/s to less than 10 Mbit/s subscriptions: Refers to all fixed -broadband Internet subscriptions with advertised downstream speeds equal to, or greater than, 2 Mbit/s and less than 10 Mbit/s. \tEqual to or above 10 Mbit/s subscriptions (4213_G10). Refers to all fixed - broadband Internet subscriptions with advertised downstream speeds equal to, or greater than, 10 Mbit/s. ITU collects data for this indicator through an annual questionnaire from national regulatory authorities or Information and Communication Technology (ICT) Ministries, who collect the data from national Internet service providers. The data can be collected by asking each Internet service provider in the country to provide the number of their fixed-broadband subscriptions by the speeds indicated. The data are then added up to obtain the country totals.","Fixed Internet Broadband Subscriptions, by speed, over 200 kbps in at least one direction","Fixed Internet Broadband Subscriptions, by speed, over 200 kbps in at least one direction",,Twice a Year,"Data as of December 31, 2015","Date Released: November 2016 (data as of December 31, 2015)",Not available.,Donna Christianson,Donna.Christianson@fcc.gov,Internet Access Services,null,null,"The FCC collects information about broadband Internet access subscriptions in service that have downstream bandwidths exceeding 200 kbps, rather than 256 kbps. Also, consistent with differences between the North American and European digital hierarchies, the first natural breakpoint in downstream bandwidth in the U.S. data is 1.5 Mbps (that is DS-1) rather than 2 Mbps",true,"Web source: Figure 28, Internet Access Services: Status as of December 31, 2015 (released November 2016) and Figure 28, Internet Access Services: Status as of December 30, 2014 (released March 2016). https://www.fcc.gov/reports-research/reports/internet-access-services-reports/internet-access-services-reports as collected by FCC Form 477 and compiled by the FCC Wireline Competition Bureau.","Data is derived from information about Internet access connections in the United States as collected by Federal Communications Commission (FCC) Form 477 and published in its Internet Access Services report. For purposes of that report, Internet broadband access connections are those in service, over 200 kilobits per second (kbps) in at least one direction, and reported to the FCC through Form 477. Form 477 collects information about fixed Internet access connections in service to end-user premises that are advertised to deliver information to and/or from the end user – that is, in at least one direction – at transfer rates (speeds) above 200 kilobits per second (kbps). Information is collected about the number of connections by the advertised speeds associated with each product subscribed to in the relevant geographic area (census tracts for fixed). Fixed providers report connections by the maximum advertised upload and download speeds. Fixed connections are further categorized by the technology employed by the part of the connection that terminates at the end-user premises. “End users” are residential, business, institutional, or government entities who use services for their own purposes and who do not resell such services to other entities. Facilities-based providers report information about connections they provide directly to their own end-user customers and also connections that they provide to Internet Service Providers for resale to end users. For Form 477 purposes, the facilities-based provider of a fixed broadband connection is the entity that owns the portion of the physical facility (or obtains the right to use dark fiber or satellite transponder capacity as part of its own network) that terminates at the end-user premises and provisions/equips it as broadband, obtains an unbundled network element (UNE), special access line, or other leased facility that terminates at the end-user premises and provisions/equips it as broadband, or provisions/equips broadband over terrestrial wireless spectrum to the end-user premises. The mutually exclusive Form 477 fixed technology categories are: asymmetric Digital Subscriber Line (aDSL), symmetric Digital Subscriber Line (sDSL), other copper wireline, cable modem, optical carrier / fiber to the end user, satellite, terrestrial fixed wireless (using licensed or unlicensed spectrum), electric power line, and all other (which is included to capture deployment of additional technologies over time). In the Form 477 data collection, aDSL-based services delivered over fiber-to-the-node architecture are reported in the aDSL category. The other wireline category comprises T1/DS1, T3/DS3, and other copper-based connections, not elsewhere categorized, that deliver Internet access service at the end-user premises. Ethernet connections delivering Internet access service are reported in the other wireline category if the connection terminates over copper and in the fiber-to-the-premises (FTTP) category if the connection terminates over fiber. Connections deployed over hybrid fiber-coax (HFC) architecture are reported in the cable modem category. Wireless ISPs (WISPs) and satellite network operators report in the fixed wireless category. Internet Access Services reports: https://www.fcc.gov/reports-research/reports/internet-access-services-reports/internet-access-services-reports","Broadband, Internet, Telecommunications",National,November 2016,,Straight counts rounded to the nearest thousand,"International Telecommunication Union (ITU) World Telecommunica-tion/ICT Indicators data for indicators i4213_256to2, i4213_2to10, and i4213_G10 collected annually through two (one short and one long) questionnaires. http://www.itu.int/en/ITU-D/Statistics/Pages/datacollection/default.aspx FCC: Internet Access Services reports: https://www.fcc.gov/reports-research/reports/internet-access-services-reports/internet-access-services-reports",0,0
127,"Total amount of approved funding for developing countries to promote the development, transfer, dissemination and diffusion of environmentally sound technologies",/17-7-1/,17,indicator,17.7.1,null,null,null,null,unk,null,null,3,OECD,17.7,false,,http://unstats.un.org/sdgs/files/metadata-compilation/Metadata-Goal-17.pdf,15,"Total amount of approved funding for developing countries to promote the development, transfer, dissemination and diffusion of environmentally sound technologies","Promote the development, transfer, dissemination and diffusion of environmentally sound technologies to developing countries on favourable terms, including on concessional and preferential terms, as mutually agreed.",,null,null,,null,null,null,null,null,null,null,null,null,null,,null,,null,null,null,null,null,,0,0
128,Proportion of individuals using the Internet,/17-8-1/,17,indicator,17.8.1,prop_indiv_using_internet,longitudinal,,Line graph,Graphed,null,null,1,ITU,17.8,true,"The Internet has become an increasingly important tool to access public information, which is a relevant means to protect fundamental freedoms. The number of Internet users has increased substantially over the last decade and access to the Internet has changed the way people live, communicate, work and do business. Internet uptake is a key indicator tracked by policy makers and others to measure the development of the information society and the growth of Internet content  including user-generated content  provides access to increasing amounts of information and services. Despite growth in networks, services and applications, information and communication technology (ICT) access and use is still far from equally distributed, and many people cannot yet benefit from the potential of the Internet. This indicator highlights the importance of Internet use as a development enabler and helps to measure the digital divide, which, if not properly addressed, will aggravate inequalities in all development domains. Classificatory variables for individuals using the Internet  such as age, sex, education level or labour force status  can help identify digital divides in individuals using the Internet. This information can contribute to the design of targeted policies to overcome those divides. The proportion of individuals using the Internet is an established indicator and also one of the three ICT-related Millennium Development Goal (MDG) indicators (for Target 8F). It is part of the Partnership on Measuring ICT for Developments Core List of Indicators, which has been endorsed by the UN Statistical Commission (last time in 2014). It is also included in the ITU ICT Development Index, and thus considered a key metric for international comparisons of ICT developments.",http://unstats.un.org/sdgs/files/metadata-compilation/Metadata-Goal-17.pdf,16,Proportion of individuals using the Internet,"Fully operationalize the technology bank and science, technology and innovation capacity-building mechanism for least developed countries by 2017 and enhance the use of enabling technology, in particular information and communications technology.","This indicator is defined as the proportion of individuals who used the Internet from any location in the last three months. The Internet is a worldwide public computer network. It provides access to a number of communication services including the World Wide Web and carries e-mail, news, entertainment and data files, irrespective of the device used (not assumed to be only via a computer _ it may also be by mobile telephone, tablet, PDA, games machine, digital TV etc.). Access can be via a fixed or mobile network. For countries that collect data on this indicator through an official survey, this indicator is calculated by dividing the total number of in-scope individuals using the Internet (from any location) in the last 3 months by the total number of in-scope individuals. For countries that have not carried out an official survey, data are estimated (by ITU) based on the number of Internet subscriptions and other socioeconomic indicators such as for example GNI per capita, and on the time series data of the indicator.",Proportion of individuals using the Internet,"Proportion of individuals using the Internet, age 3 and over",,Annual or biennial,The 2015 questionnaire asked about Internet use during the past 6 months. Earlier questionnaires did not specify a reference period.,March 2016,,Jamie Lewis,jamie.michelle.lewis@census.gov,"U.S. Census Bureau, Current Population Survey Internet Use Supplements",null,null,NA,true,Web source: NTIA Digital Nation Data Explorer http://www.ntia.doc.gov/other-publication/2016/digital-nation-data-explorer,"Data are derived from the 1) Computer and Internet Use and 2) School Enrollment and Internet Use Supplements of the Current Population Survey (CPS). The Census Bureau and Bureau of Labor Statistics jointly sponsor the CPS. The Census Bureau and National Center for Education Statistics jointly sponsored the 2007 and 2009-2010 supplements, and the National Telecommunications and Information Administration sponsored the 2011-2013 and 2015 supplements. Data are collected by the Census Bureau. Individuals using the Internet: Persons age 3 and over who use the Internet from any location. Metadata sources: http://www.census.gov/programs-surveys/cps/technical-documentation/complete.html","Available by age group, employment status, income (2010 forward), education, sex, race and Hispanic origin, disability status (2009 forward), metropolitan status, and whether school-aged child in household",National and by state,September 2016,,Proportion,NA,0,0
129,"Dollar value of financial and technical assistance (including through North-South, South-South and triangular cooperation) committed to developing countries",/17-9-1/,17,indicator,17.9.1,null,null,null,null,Assigned,null,null,1,OECD,17.9,true,ODA covers the value of both financial and technical assistance for development purposes. The above sectors broadly correspond to the coverage of the SDGs and focus on capacity building and national planning opposed to the implementation of specific projects and programmes.,http://unstats.un.org/sdgs/files/metadata-compilation/Metadata-Goal-17.pdf,18,"Dollar value of financial and technical assistance (including through North-South, South-South and triangular cooperation) committed to developing countries","Enhance international support for implementing effective and targeted capacity-building in developing countries to support national plans to implement all the sustainable development goals, including through North-South, South-South and triangular cooperation.","Official development assistance (ODA;http://www.oecd.org/dac/dac-glossary.htm#ODA) to countries on the DAC List of ODA Recipients (http://www.oecd.org/dac/dac-glossary.htm#DAC_List) in the following subsectors as explained in the list of Creditor Reporting System purpose codes available here, http://www.oecd.org/dac/stats/purposecodessectorclassification.htm: \t11110 Education policy and administrative management \t12110 Health policy and administrative management \t13010 Population policy and administrative management \t14010 Water sector policy and administrative management \t15110 Public sector policy and administrative management \t15210 Security system management and reform \t16020 Employment policy and administrative management \t16030 Housing policy and administrative management \t21010 Transport policy and administrative management \t22010 Communications policy and administrative management \t23110 Energy policy and administrative management \t24010 Financial policy and administrative management \t31110 Agricultural policy and administrative management \t31210 Forestry policy and administrative management \t31310 Fishing policy and administrative management \t32110 Industrial policy and administrative management \t32210 Mineral/mining policy and administrative management \t32310 Construction policy and administrative management \t33110 Trade policy and administrative management \t33210 Tourism policy and administrative management \t41010 Environmental policy and administrative management",null,null,,null,null,null,null,null,null,null,null,null,null,,null,,null,null,null,null,null,,0,0
130,Prevalence of undernourishment,/2-1-1/,2,indicator,2.1.1,null,null,null,ERS does not have this.,unk,null,null,1,FAO,2.1,true,,http://unstats.un.org/sdgs/files/metadata-compilation/Metadata-Goal-2.pdf,2,Prevalence of undernourishment,"By 2030, end hunger and ensure access by all people, in particular the poor and people in vulnerable situations, including infants, to safe, nutritious and sufficient food all year round.","The Prevalence of Undernourishment (PoU) is defined as the probability that a randomly selected individual from the reference population is found to consume less than his/her calorie requirement for an active and healthy life. It is written as: ______ =  __(__)____ __<________ where f(x) is the probability density function of per capita calorie consumption and MDER is a Minimum Dietary Energy Requirement. The MDER threshold is computed on the basis of normative energy requirement standards referred to a minimum level of physical activity. Estimates of the number of undernourished (NoU) - calculated by multiplying the PoU by the size of the reference population - are used to monitor progress towards the World Food Summit goal of reducing by half the number of people suffering from undernourishment. The parameters needed for the calculation of the indicator are: the mean level of dietary energy consumption (DEC); a cut-off point defined as the Minimum Dietary Energy Requirement (MDER); the coefficient of variation (CV) as a parameter accounting for inequality in food consumption; and a skewedness (SK) parameter accounting for asymmetry in the distribution. The DEC as well as the MDER are updated annually, with the former calculated from the FAO Food Balance Sheets. The MDER is calculated as a weighted average of energy requirements according to sex and age class, and is updated each year from UN population ratio data. The inequality in food consumption parameters are derived from National Household Survey data when such data is available and reliable. Due to the limited number of available household surveys, the inequality in food access parameters are updated much less frequently over time than the DEC and MDER parameters.",null,null,,null,null,null,null,null,null,null,null,null,null,,null,,null,null,null,null,null,,0,0
131,"Prevalence of moderate or severe food insecurity in the population, based on the Food Insecurity Experience Scale (FIES)",/2-1-2/,2,indicator,2.1.2,severe_food_insec,bar,,Bar graph,Graphed,null,null,1,FAO,2.1,true,,http://unstats.un.org/sdgs/files/metadata-compilation/Metadata-Goal-2.pdf,4,"Prevalence of moderate or severe food insecurity in the population, based on the Food Insecurity Experience Scale (FIES)","By 2030, end hunger and ensure access by all people, in particular the poor and people in vulnerable situations, including infants, to safe, nutritious and sufficient food all year round.","These are in reality two related indicators, representing the percentage of individuals in the national adult population (15 or more years of age) that have experienced moderate or severe levels and severe levels of food insecurity respectively, during the previous year.Severity of food insecurity is defined as the extent to which people have difficulties in accessing food of adequate quality and/or quantity due to lack of money or other resources. Difficulties include also psychological concerns associated with the struggle in accessing food.",Food insecurity as measured by FAO’s Food Insecurity Experience Scale.,Comparable prevalence rates of food insecurity experienced by adults throughout the world.,,Annual,Last 12 months,"Not set. Last release in April 2016, updated in August 2016.",Unknown,Constance Newman,cnewman@ers.usda.gov,Economic Research Service reporting estimates from the Food Insecurity Experience Scale as published by FAO.,null,null,"Food security is based on the Rasch measurement model. The FIES as part of the GWP has only been administered for two years and only one year of data (2014) is publicly available so far. While the FIES is based on well-validated experiential food security measures it’s use as an international standard for assessing food security is relatively new. Note that the FAO FIES measure should be used for international comparisons, but the USDA food security measure should be used for more detailed information on U.S. food security. The prevalence of moderate and severe food insecurity in the U.S. per the FIES standard was 10.2 percent with a margin of error of plus or minus 0.27 percent. The prevalence of severe food insecurity in the U.S. per the FIES standard was 1.2 percent with a margin of error of plus or minus 0.08 percent.",true,http://www.fao.org/in-action/voices-of-the-hungry/en/,"“Food security exists when all people, at all times, have physical, social and economic access to sufficient safe and nutritious food that meets their dietary needs and food preferences for an active and healthy life” (FAO, 2009). FAO sponsors the Food Insecurity Experience Scale Survey Module (FIES-SM) as part of the Gallup World Poll (GWP) and collects information on food insecurity in 150 countries. FAO has created a global standard to create comparable estimates of moderate and severe food insecurity in countries around the world. The GWP obtains a nationally representative sample in each country through either phone or in person surveys. FAO’s Voices of the Hungry Technical Report: http://www.fao.org/3/a-i4830e.pdf Where it is possible, FAO uses Federal surveys already measuring food insecurity to produce food insecurity estimates that are comparable in severity to the FIES. For the United States, FAO utilizes Current Population Survey Food Security Supplement to produce estimates of moderate and severe food insecurity. This is the same data used in USDA’s annual household food security report, but threshold for food insecurity as defined by FAO global standard is different from USDA’s threshold for food insecurity. USDA’s Household Food Security in the United States in 2015: http://www.ers.usda.gov/publications/pub-details/?pubid=79760",Not reported by FAO.,Not reported by FAO.,November 2016,,"Prevalence estimates, percentage of adults experiencing food insecurity in the past 12 months.",http://www.fao.org/in-action/voices-of-the-hungry/en/ http://www.ers.usda.gov/topics/food-nutrition-assistance/food-security-in-the-us.aspx,0,0
