,title,permalink,sdg_goal,layout,indicator,indicator_variable,graph,graph_title,graph_type_description,graph_status_notes,variable_description,variable_notes,un_designated_tier,un_custodial_agency,target_id,has_metadata,rationale_interpretation,goal_meta_link,goal_meta_link_page,indicator_name,target,indicator_definition,actual_indicator_available,actual_indicator_available_description,method_of_computation,periodicity,time_period,date_of_national_source_publication,scheduled_update_by_national_source,source_agency_staff_name,source_agency_staff_email,source_agency_survey_dataset,source_title,source_notes,comments_and_limitations,published,source_url,us_method_of_computation,disaggregation_categories,disaggregation_geography,date_metadata_updated,scheduled_update_by_SDG_team,unit_of_measure,international_and_national_references,graoh,variable_unit_label
179,Volume of official development assistance flows for scholarships by sector and type of study,/4-b-1/,4,indicator,4.b.1,i4_b_1_total,bar,,Bar graph,Graphed,null,null,1,OECD,4.b,true,http://www.oecd.org/investment/stats/44479737.pdf,http://unstats.un.org/sdgs/files/metadata-compilation/Metadata-Goal-4.pdf,14,Volume of official development assistance flows for scholarships by sector and type of study,"By 2020, substantially expand globally the number of scholarships available to developing countries, in particular least developed countries, small island developing States and African countries, for enrolment in higher education, including vocational training and information and communications technology, technical, engineering and scientific programmes, in developed countries and other developing countries.",Total net official development assistance (ODA,USAID assistance for education development assistance,"USAID programs are focused on: Improving reading skills in primary schools; Strengthening higher education and workforce development programs;Expanding access to education in regions witnessing crisis and conflict; and Fostering innovation in education through All Children Reading. Variable Label i4_b_1_total\tDevelopment assistance, total education i4_b_1_basic\tDevelopment assistance, basic education i4_b_1_higher\tDevelopment assistance, higher education",http://www.oecd.org/dac/dac-glossary.htm#ODA) for scholarships and student costs in donor countries (types of aid,Annual,2013 to 2015,March 2016,March 2017,Tom Snyder,tom.snyder@ed.gov,USAID,null,null,,true,https://www.usaid.gov/education,Data available from budget documents.,Basic and Higher Education,National,November 2016,,Dollar,https://www.usaid.gov/results-and-data/budget-spending/congressional-budget-justification,0,0
180,Percentage of teachers in: (a) pre-primary (b) primary (c) lower secondary and (d) upper secondary education who have received at least the minimum organized teacher training (i.e. pedagogical training) pre-service or in-service required for teaching at the relevant level in a given country,/4-c-1/,4,indicator,4.c.1,pctteachers_prep,bar,,Line graph,Graphed,null,null,1,UNESCO,4.c,true,"From UNESCO: Teachers play a key role in ensuring the quality of education provided. Ideally all teachers should receive adequate, appropriate and relevant pedagogical training to teach at the chosen level of education and be academically well-qualified in the subject(s) they are expected to teach. This indicator measures the share of the teaching work force which is pedagogically well-trained. From OECD: To provide policy-relevant analysis on teachers participation in professional development activities through a robust indicator.",http://unstats.un.org/sdgs/files/metadata-compilation/Metadata-Goal-4.pdf,15,Percentage of teachers in: (a) pre-primary (b) primary (c) lower secondary and (d) upper secondary education who have received at least the minimum organized teacher training (i.e. pedagogical training) pre-service or in-service required for teaching at the relevant level in a given country,"By 2030, substantially increase the supply of qualified teachers, including through international cooperation for teacher training in developing countries, especially least developed countries and small island developing States.","From UNESCO: The percentage of teachers by level of education taught (pre-primary, primary, lower secondary and upper secondary) who have received at least the minimum organized pedagogical teacher training pre-service and in-service required for teaching at the relevant level in a given country. The indicator should be calculated separately for public and private institutions. From OECD: Teachers (ISCED 2 level) were asked to indicate whether they had participated in any of the following activities 12 months prior to the survey: \tCourses/workshops (on subject matter or methods and/or other education-related topics). \tEducation conferences or seminars (where teachers and/or researchers present their research results and discuss education problems). \tObservation visits to other schools. \tObservation visits to business premises, public organisations, or non-governmental organisations. \tIn-service training courses in business premises, public organisations or non-governmental organisations. \tQualification programmes (e.g. a degree programme). \tParticipation in a network of teachers formed specifically for the professional development of teachers. \tIndividual or collaborative research on a topic of professional interest. \tMentoring and/or peer observation and coaching as part of a formal school arrangement",Percentage of public elementary and secondary school teachers who have regular certification or probationary certification (only requiring fulfillment of a probationary employment period.,"The Schools and Staffing Survey (SASS) was conducted by NCES seven times between 1987 through 2011. SASS was an integrated study public and private school districts, schools, principals, and teachers designed to provide descriptive data on the context of elementary and secondary education. SASS covered a wide range of topics from teacher demand, teacher and principal characteristics, general conditions in schools, principals and teachers perceptions of school climate and problems in their schools, teacher compensation, district hiring and retention practices, to basic characteristics of the student population. After 2010–11, NCES redesigned SASS and named it the National Teacher and Principal Survey (NTPS) to reflect the redesigned studys focus on the teacher and principal labor market and on the state of K-12 school staff. NCES first conducted NTPS in 2015–16. Data will be released in late 2016 or early 2017. Variable name Description of variable pctteachers_prep\t\t\t Percent of public school teachers with certification, preprimary pctteachers_prim\t\t\t Percent of public school teachers with certification, primary pctteachers_lowersec\t\t\tPercent of public school teachers with certification, lower secondary pctteachers_uppersec\t\t\tPercent of public school teachers with certification, upper secondary pctteachers_multiple levels\t\tPercent of public school teachers with certification, multiple levels",Percentage of public schoool teachers who have regular certification or probationary certification (only require fulfillment of probationary employment period.,Data collected every 4 years,2007-08 and 2011-12,7/2/2013,2017,Tom Snyder,tom.snyder@ed.gov,"National Center for Education Statistics, Schools and Staffing Survey",null,null,"Coverage of prekindergarten teachers is only partial. Many teachers teach more than one academic level, and included in the tabulation as multiple levels.",true,http://nces.ed.gov/surveys/sass/,"Using nationally representative sample of public school teachers, percentage of teachers with regular or probationary certification.",Teacher level of instruction,NA,10/03/2016,,Teacher,,0,0
181,"Whether or not legal frameworks are in place to promote, enforce and monitor equality and non-discrimination on the basis of sex",/5-1-1/,5,indicator,5.1.1,null,null,null,null,Policy Judgement,null,null,3,UN WOMEN,5.1,true,"Laws and justice systems shape society by ensuring accountability, stopping the abuse of power and creating norms about what is acceptable. Removing discriminatory laws and putting in place laws and policies that promote gender equality is a prerequisite to ending discrimination against women and girls. \nBecause this indicator monitors laws, it focuses on de-jure equality between women and men and girls and boys and instances where legal frameworks promote gender equality and womens empowerment. This is not to say that de-facto inequality should not be prioritized. In fact, even where discrimination is explicitly prohibited by law, unequal outcomes between women and men and boys and girls can be the result of discriminatory practices that prevent women and girls from enjoying their human rights. \nMost of the indicators proposed to monitor the targets in SDG5 and the genderrelated indicators to monitor the targets in the other goals focus on outcomes. By focusing on laws, it is possible to juxtapose the different areas of law that are measured under 5.1 (e.g. laws to prevent sexual assault) to the actual results (rates of sexual violence against women and girls as measured in target 5.2). Therefore, the proposed focus on laws and policies is meant to complement the outcome indicators proposed under the other targets in Goal 5 and the gender-related targets in other goals.",http://unstats.un.org/sdgs/files/metadata-compilation/Metadata-Goal-5.pdf,2,"Whether or not legal frameworks are in place to promote, enforce and monitor equality and non-discrimination on the basis of sex",End all forms of discrimination against all women and girls everywhere.,"The indicator measures whether national laws exist to promote gender equality and non-discrimination against women and girls. Areas of law to be monitored as part of this indicator are tentative but could include: whether equal pay for work of equal value is guaranteed in law; whether national legislation is in line with International Labour Organization (ILO) Convention 183 on maternity protection; whether national law prohibits discrimination based on a definition of discrimination against women in accordance with article 1 of the Convention on the Elimination of All Forms of Discrimination against Women (CEDAW); whether the national law provides equal rights for women and men with respect to inheritance and property; and the existence of laws (including criminal) against sexual assault. For each area of law under consideration, the indicator is the number of countries with specific legislation to promote gender equality and non-discrimination (i.e. countries with yes) as a percentage of all countries with available data. A simple aggregation method (e.g. arithmetic or geometric mean) will then be used to calculate global and/or regional averages (taking into account all of the different areas of laws).",null,null,,null,null,null,null,null,null,null,null,null,null,,null,,null,null,null,null,null,,0,0
182,"Proportion of ever-partnered women and girls aged 15 years and older subjected to physical, sexual or psychological violence by a current or former intimate partner in the previous 12 months, by form of violence and by age",/5-2-1/,5,indicator,5.2.1,rev_rape_def,bar,Estimated number of rapes in US,Bar graph,Graphed,null,null,2,UNICEF,5.2,true,,http://unstats.un.org/sdgs/files/metadata-compilation/Metadata-Goal-5.pdf,4,"Proportion of ever-partnered women and girls aged 15 years and older subjected to physical, sexual or psychological violence by a current or former intimate partner in the previous 12 months, by form of violence and by age","Eliminate all forms of violence against all women and girls in the public and private spheres, including trafficking and sexual and other types of exploitation.",Estimated volume number of reported rape for the revised and legacy definitions.,Estimated Number of Rape - Revised and Legacy Definitions Reported to the FBI UCR Program.,"This table contains estimated volume numbers based on both the FBI UCR Programs legacy and revised definitions of rape. The data do not include other forms of violence other than rape. The data include all rapes reported to the FBI UCR Program and are not limited to intimate partner. In 2013, the FBI UCR Program initiated the collection of rape data under a revised definition and removed the term “forcible” from the offense name. Column heading Year - is the year the data represents. Column Heading Revised Rape Definitions are the estimates of data collected under the revised rape definition: Penetration, no matter how slight, of the vagina or anus with any body part or object, or oral penetration by a sex organ of another person, without the consent of the victim. (This includes the offenses of rape, sodomy, and sexual assault with an object as converted from data submitted via the National Incident-Based Reporting System [NIBRS].) Column Heading Legacy Rape Definition are the estimates of data collected under the legacy rape definition: The carnal knowledge of a female forcibly and against her will Indicator data on sexual assault is available in the National Incident-Based Reporting System (NIBRS); however, NIBRS currently represents less than 30% of the nations population and nonresponse cannot be modeled to adjust for bias because statistical sampling methodologies were not used.",NA,Annual,Annual,"Monday, September 26, 2016",,,CRIMESTATSINFO@ic.fbi.gov,,null,null,"The data do not include other forms of violence other than rape. The data include all rapes reported to the FBI UCR Program and are not limited to intimate partner. In 2013, the Summary UCR definition of rape was changed to “penetration, no matter how slight, of the vagina or anus with any body part or object, or oral penetration by a sex organ of another person, without the consent of the victim.” The new definition updated the 80-year-old historical definition of rape which was “carnal knowledge of a female forcibly and against her will.” Effectively, the revised definition expands rape to include both male and female victims and offenders, and reflects the various forms of sexual penetration understood to be rape, especially nonconsenting acts of sodomy, and sexual assaults with objects. https://ucr.fbi.gov/crime-in-the-u.s/2015/crime-in-the-u.s.-2015/resource-pages/rape_addendum-2015-_final",true,https://ucr.fbi.gov/crime-in-the-u.s/2015/crime-in-the-u.s.-2015/home,"Agencies submit data based on only one of these definitions. Within each population group size, the proportion of female rape victims was calculated from all NIBRS reports of rape, sodomy, and sexual assault with an object. For agencies that reported using the revised definition, the actual number of reported rapes was decreased by the calculated proportion to arrive at an estimate for the number of rapes using the legacy definition. Conversely, for agencies that reported using the legacy definition, the actual number of reported rapes was increased by the inverse of the proportion to arrive at an estimate for the number of rapes using the revised definition.",NA,National,December 2016,,Estimated Volume Number,https://ucr.fbi.gov/crime-in-the-u.s/2015/crime-in-the-u.s.-2015/home,0,0
183,"Proportion of women and girls aged 15 years and older subjected to sexual violence by persons other than an intimate partner in the previous 12 months, by age and place of occurrence",/5-2-2/,5,indicator,5.2.2,null,null,null,US does not collect these data separately from 5.2.1.,unk,null,null,2,UNICEF,5.2,true,"Violence against women and girls is one of the most pervasive human rights abuses in the world today and takes place in all countries. In order to eradicate violence against women and girls, it is necessary to measure its prevalence in all its forms. \nBy measuring the prevalence of sexual violence by persons other than an intimate partner, this indicator complements the other priority indicator in 5.2 (i.e. the proportion of ever-partnered women and girls aged 15+ subjected to physical, sexual and psychological violence by a current or former intimate partner, in the last 12 months, by form of violence and age). \nFurthermore, by disaggregating this indicator by place of occurrence and perpetrator, this indicator would measure sexual violence in the workplace and in public spaces. \n\n Intimate partner violence includes abuse perpetrated by a current or former partner within the context of marriage, cohabitation or any other formal or informal union. Violence directed at girls and women is the most common form of gender-based violence.",http://unstats.un.org/sdgs/files/metadata-compilation/Metadata-Goal-5.pdf,4,"Proportion of women and girls aged 15 years and older subjected to sexual violence by persons other than an intimate partner in the previous 12 months, by age and place of occurrence","Eliminate all forms of violence against all women and girls in the public and private spheres, including trafficking and sexual and other types of exploitation.","Number of girls and women aged 15+ who were subjected to sexual violence by persons other than an intimate partner, as percentage of all girls and women aged 15+, disaggregated by age and place of occurrence. Sexual violence as defined in para 60 of the UN Guidelines for Producing Statistics on Violence against Women: Statistical Surveys [1]: ... is any sort of harmful or unwanted sexual behavior that is imposed on someone. It includes act of abusive sexual contact, forced engagement in sexual acts, attempted or completed sexual acts with a woman without her consent, sexual harassment, verbal abuse, threats, exposure, unwanted touching, incest, etc. A minimum list of acts of sexual violence, which should be expanded depending on the specific country context, consists of the following: (a) Rape: Refers to engaging in the non-consensual vaginal, anal, or oral penetration of a sexual nature of the body of another person with any bodily part or object, including through the use of physical violence and by putting the victim in a situation where she cannot say no or complies because of fear; (b) Attempted rape: Refers to attempting to have non-consensual sexual intercourse through the use of force or threats; (c) Other sexual acts: Refers to: \tIntimate touching without consent \tSexual acts other than intercourse forced by money \tSexual acts other than intercourse obtained through threats of physical violence \tSexual acts other than intercourse obtained through threats to the well-being of family members \tUse of force or coercion to obtain unwanted sexual acts or any sexual activity that the female partner finds degrading or humiliating \tOther acts of sexual violence. The indicator specifically considers the following: 1) sexual violence (separately from physical violence); 2) women and girls aged 15+ who were subjected to sexual violence; and 3) by perpetrators who are persons other than an intimate partner. This indicator provides the proportion of ever-partnered girls and women aged 15+ subjected to physical, sexual or psychological violence in the last 12 months by a current or former intimate partner. It is calculated by dividing the number of ever-partnered girls and women aged 15+ subjected to physical, sexual or psychological in the last 12 months by a current or former intimate partner by the total number of ever-partnered girls and women aged 15+ in the population.",,,NA,,,,,,,,null,null,,true,,,,,,,,,0,0
184,Proportion of women aged 20-24 years who were married or in a union before age 15 and before age 18,/5-3-1/,5,indicator,5.3.1,null,null,null,Pending edited 2014 SIPP,Assigned,null,null,2,"UNICEF WHO, UNFPA, UN Women, UN DESA-Pop Division",5.3,true,"Marriage before the age of 18 is a fundamental violation of human rights. Child marriage often compromises a girls development by resulting in early pregnancy and social isolation, interrupting her schooling, limiting her opportunities for career and vocational advancement and placing her at increased risk of intimate partner violence. In many cultures, girls reaching puberty are expected to assume gender roles associated with womanhood. These include entering a union and becoming a mother. \nThe issue of child marriage is addressed in a number of international conventions and agreements: The Convention on the Elimination of All Forms of Discrimination against Women (Article 16); Universal Declaration of Human Rights; Convention on Consent to Marriage, Minimum Age for Marriage and Registration of Marriages; African Charter on the Rights and Welfare of the Child; and the Protocol to the African Charter on Human and Peoples Rights on the Rights of Women in Africa. Although marriage is not mentioned directly in the Convention on the Rights of the Child, child marriage is linked to other rights  such as the right to freedom of expression, the right to protection from all forms of abuse, and the right to be protected from harmful traditional practices.",http://unstats.un.org/sdgs/files/metadata-compilation/Metadata-Goal-5.pdf,9,Proportion of women aged 20-24 years who were married or in a union before age 15 and before age 18,"Eliminate all harmful practices, such as child, early and forced marriage and female genital mutilation.",This indicator provides the proportion of women aged 20 to 24 years who were first married or in union by age 18. It is calculated by dividing the number of women aged 20-24 who were first married or in union by age 18 by the total number of women aged 20-24 in the population.,null,null,,null,null,null,null,null,null,null,null,null,null,,null,,null,null,null,null,null,,0,0
185,"Proportion of girls and women aged 15-49 years who have undergone female genital mutilation/cutting, by age",/5-3-2/,5,indicator,5.3.2,null,null,null,CDC program (incl NCHS) has no data,unk,null,null,2,"UNICEF UNFPA, WHO",5.3,true,"From UNICEF: \nFGM/C is a violation of girls and womens human rights. There is also a large body of literature documenting the adverse health consequences of FGM/C over both the short and long term. FGM/C is condemned by a number of international treaties and conventions including the Universal Declaration of Human Right (Article 25). FGM/C can also be considered as a form of violence against women, and therefore the UN Convention on the Elimination of All Forms of Discrimination against Women can be invoked. Similarly, defining it as a form of torture brings it under the rubric of the Convention against Torture and Other Cruel, Inhuman, or Degrading Treatment or Punishment. Moreover, since FGM/C is regarded as a traditional practice prejudicial to the health of children and is, in most cases, performed on minors, it violates the Convention on the Rights of the Child. Existing national legislation in many countries also include explicit bans against FGM/C. \n\nFrom WHO: \n Female genital mutilation (FGM) comprises all procedures that involve the partial or total removal of external genitalia or other injury to the female genital organs for non-medical reasons [1]. Although it is internationally recognized as a violation of human rights (including: the right to non-discrimination on the grounds of sex; the right to life; the right to the highest attainable standard of health; the right to freedom From torture or cruel, inhuman or degrading treatment; and the rights of the child), and legislation to prohibit the procedure has been put in place in many countries, the practice has still been documented. \nWHO classifies FGM into four types: [1] \n\tType I: Partial or total removal of the clitoris and/or the prepuce (clitoridectomy). \n\tType II: Partial or total removal of the clitoris and the labia minora, with or without excision of the labia majora (excision). \n\tType III: Narrowing of the vaginal orifice with the creation of a covering seal by cutting and appositioning the labia minora and/or the labia majora, with or without excision of the clitoris (infibulation). \n\tType IV: All other harmful procedures to the female genitalia for non-medical purposes, for example: pricking, pulling, piercing, incising, scraping and cauterization. \nThe removal of or damage to healthy, normal genital tissue interferes with the natural functioning of the body and causes several immediate and long-term health consequences.",http://unstats.un.org/sdgs/files/metadata-compilation/Metadata-Goal-5.pdf,10,"Proportion of girls and women aged 15-49 years who have undergone female genital mutilation/cutting, by age","Eliminate all harmful practices, such as child, early and forced marriage and female genital mutilation.",From UNICEF: This indicator provides the proportion of girls and women aged 15 to 49 years who have undergone female genital mutilation/cutting (FGM/C). It is calculated by dividing the number of girls and women aged 15-49 who have undergone FGM/C by the total number of girls and women aged 15-49 in the population From WHO: The numerator is the number of women and girls who have undergone a FGM procedure (Type 1 to IV). The denominator is the number of women and girls in the same population,null,null,,null,null,null,null,null,null,null,null,null,null,,null,,null,null,null,null,null,,0,0
